{
  "book": 19,
  "chapter": 117,
  "verses": [
    {
      "v": 1,
      "zh": "万国啊，你们都当赞美耶和华！万民哪，你们都当颂赞他！",
      "en": "Praise the Lord, all you nations.Applaud him, all you foreigners.[NOTE:1]",
      "notes": [
        "Psalm 117. The psalmist tells the nations to praise the Lord for his loyal love and faithfulness."
      ],
      "he": [
        {
          "w": "הַֽלְל֣וּ",
          "morph": "HVpv2mp"
        },
        {
          "w": "אֶת",
          "morph": "HTo"
        },
        {
          "w": "יְ֭הוָה",
          "morph": "HNp"
        },
        {
          "w": "כָּל",
          "morph": "HNcmsc"
        },
        {
          "w": "גּוֹיִ֑ם",
          "morph": "HNcmpa"
        },
        {
          "w": "שַׁ֝בְּח֗וּהוּ",
          "morph": "HVpv2mp/Sp3ms"
        },
        {
          "w": "כָּל",
          "morph": "HNcmsc"
        },
        {
          "w": "הָאֻמִּֽים",
          "morph": "HTd/Ncfpa"
        }
      ],
      "commentary": "117:1 This Psalm begins and concludes with the Piel IMPERATIVE, \"Praise\" (BDB 237,\nKB 248, cf. Psalm 113; LXX, Psalm 116). Psalms 113-118 are called the Hallel Psalms from this root\n\n▣ \"Laud Him\" This is a second Piel IMPERATIVE (BDB 986, KB 1387,\ncf. Ps. 147:12) and is a SYNONYM of \"praise,\" v. 1a.\n\n▣ \"all nations. . .all peoples\" This universal aspect is characteristic of the Psalms (cf. Ps. 22:27; 33:8;\n47:1; 66:1,4; 67:3-5,7; 82:8; 96:7-10; 98:4; 100:1).\n\nThis is the OT's great commission. Israel was to be a \"kingdom of priests\" (cf. Exod. 19:5-6) because\nall the world is YHWH's.\n\nThis verse is quoted by Paul in Rom. 15:11, which emphasizes YHWH's inclusion of the Gentiles\nin the work of Christ (cf. Rom. 15:9-13; note Rev. 7:9).\n\nSPECIAL TOPIC: YHWH'S ETERNAL REDEMPTIVE PLAN"
    },
    {
      "v": 2,
      "zh": "因为他向我们大施慈爱；耶和华的诚实存到永远。你们要赞美耶和华！",
      "en": "For his loyal love towers[NOTE:1] over us,and the Lord’s faithfulness endures.Praise the Lord.",
      "notes": [
        "Or “peoples” (see Ps 108:3)."
      ],
      "he": [
        {
          "w": "כִּ֥י",
          "morph": "HC"
        },
        {
          "w": "גָ֘בַ֤ר",
          "morph": "HVqp3ms"
        },
        {
          "w": "עָלֵ֨ינוּ",
          "morph": "HR/Sp1cp"
        },
        {
          "w": "חַסְדּ֗וֹ",
          "morph": "HNcmsc/Sp3ms"
        },
        {
          "w": "וֶֽאֱמֶת",
          "morph": "HC/Ncfsc"
        },
        {
          "w": "יְהוָ֥ה",
          "morph": "HNp"
        },
        {
          "w": "לְעוֹלָ֗ם",
          "morph": "HR/Ncmsa"
        },
        {
          "w": "הַֽלְלוּ",
          "morph": "HVpv2mp"
        },
        {
          "w": "יָֽהּ",
          "morph": "HNp"
        }
      ],
      "commentary": "117:2 \"lovingkindness. . .truth\" These two characteristics of YHWH\n(see\nSPECIAL TOPIC: CHARACTERISTICS OF ISRAEL'S GOD) are often listed together (i.e., Ps. 108:4; 115:1; 138:2).\n\nFor \"lovingkindness\" see\n\nSPECIAL TOPIC: LOVINGKINDNESS (HESED).\n\nFor \"truth\" or \"faithfulness\" see\n\nSPECIAL TOPIC: BELIEVE, TRUST, FAITH AND FAITHFULNESS IN THE OT\n\n▣ \"everlasting\" See\n\nSPECIAL TOPIC: FOREVER ('olam).\n\nThis is an important point because of Israel's repeated faithlessness and idolatry. YHWH is\nforever faithful but His people are not! He has a larger purpose than just one people/nation (see\n\nSPECIAL TOPIC: YHWH'S ETERNAL REDEMPTIVE PLAN).\n\nDISCUSSION QUESTIONS\n\nThis is a study guide commentary, which means that you are\nresponsible for your own interpretation of the Bible. Each of us must walk in the light we have. You,\nthe Bible, and the Holy Spirit are priority in interpretation. You must not relinquish this to a commentator.\n\nThese discussion questions are provided to help you think through the major issues of this\nsection of the book. They are meant to be thought-provoking, not definitive.\n\n- How common in the OT is YHWH's love, care, concern, and redemption of Gentiles?\n\n- Define hesed (i.e., lovingkindness).\n\n- Define emeth (i.e., truth).\n\n- How does YHWH's love toward Israel affect the Gentiles?"
    }
  ],
  "commentary": "STROPHE DIVISIONS OF MODERN TRANSLATIONS\n\nNASB\nNKJV\nNRSV\nTEV\nNJB\n\nA Psalm of Praise\n\nNo MT Intro\nLet All Peoples Praise the Lord\nDoxology\nIn Praise of the Lord\nSummons to Praise\n\n117:1-2\n117:1-2b\n117:1-2\n117:1-2b\n117:1-2b\n\n117:2c\n\n117:2c\n\nREADING CYCLE THREE (see\n\"Bible\nInterpretation Seminar\")\n\nFOLLOWING THE ORIGINAL AUTHOR'S INTENT AT PARAGRAPH LEVEL\n\nThis is a study guide commentary, which\nmeans that you are responsible for your own interpretation of the Bible. Each of us must walk in the\nlight we have. You, the Bible, and the Holy Spirit are priority in interpretation. You must not\nrelinquish this to a commentator.\n\nRead the chapter in one sitting. Identify the subjects (reading cycle #3). Compare\nyour subject divisions with the five translations above. Paragraphing is not inspired, but it is\nthe key to following the original author's intent, which is the heart of interpretation. Every\nparagraph has one and only one subject.\n\nCONTEXTUAL INSIGHTS\n\n- This is the shortest Psalm in the Psalter.\n\n- It encourages the Gentiles to praise Israel's God (cf. Psalm 67; 100), the only true God.\n\nSPECIAL TOPIC: MONOTHEISM\n\n- Israel's God is fully revealed in\n\n- His acts in creation (Genesis 1-2; 6-9)\n\n- His promises to Abraham (Genesis 12; 15; 18; 22)\n\n- land\n\n- seed\n\n- great name\n\n- all families of the earth blessed in him\n\nSPECIAL TOPIC: COVENANT PROMISES TO THE PATRIARCHS\n\n- redemptive acts toward Abraham's descendants (cf. Ps. 117:2a)\n\n- the exodus\n\n- conquest\n\n- return from exile\n\nWORD AND PHRASE STUDY\n\nNASB (UPDATED) TEXT: 117:1-2\n\n1Praise the Lord, all nations;\n\nLaud Him, all peoples!\n\n2For His\nlovingkindness is great toward us,\n\nAnd the truth of the Lord is everlasting.\n\nPraise the Lord!"
}
